{
    "id": "defaut",
    "label": "Défaut",
    "description": "",
    "zoomConfig": { "minZoom": null, "maxZoom": null },
    "labelScale": { "minScale": null, "maxScale": null },
    "style": {
        "color": "#6366f1",
        "opacity": 0.8,
        "weight": 2
    },
    "legend": { "label": "Réseau câbles" }
}
