{
    "id": "defaut",
    "label": "Défaut",
    "description": "Position des cyclones actifs",
    "zoomConfig": {
        "minZoom": null,
        "maxZoom": null
    },
    "labelScale": {
        "minScale": null,
        "maxScale": null
    },
    "style": {
        "radius": 8,
        "fillColor": "#9b2226",
        "fillOpacity": 0.9,
        "color": "#ffffff",
        "opacity": 1,
        "weight": 1.5
    },
    "legend": {
        "label": "Cyclone actif"
    }
}
