{
    "id": "defaut",
    "label": "Défaut",
    "description": "Ports maritimes majeurs",
    "zoomConfig": {
        "minZoom": null,
        "maxZoom": null
    },
    "labelScale": {
        "minScale": null,
        "maxScale": null
    },
    "style": {
        "radius": 5,
        "fillColor": "#0077b6",
        "fillOpacity": 0.85,
        "color": "#ffffff",
        "opacity": 1,
        "weight": 1
    },
    "legend": {
        "label": "Ports maritimes majeurs"
    }
}
