{
    "id": "defaut",
    "label": "Défaut",
    "description": "",
    "zoomConfig": { "minZoom": null, "maxZoom": null },
    "labelScale": { "minScale": null, "maxScale": null },
    "style": {
        "fillColor": "#93c5fd",
        "fillOpacity": 0.15,
        "color": "#3b82f6",
        "opacity": 0.7,
        "weight": 1.5
    }
}
