{
    "id": "defaut",
    "label": "Défaut",
    "description": "",
    "zoomConfig": { "minZoom": null, "maxZoom": null },
    "labelScale": { "minScale": null, "maxScale": null },
    "style": {
        "shape": "circle",
        "radius": 7,
        "fillColor": "#facc15",
        "fillOpacity": 1,
        "color": "#333333",
        "opacity": 1,
        "weight": 1
    },
    "legend": { "label": "Candélabres" }
}
