{
    "id": "defaut",
    "label": "Défaut",
    "description": "",
    "zoomConfig": { "minZoom": null, "maxZoom": null },
    "labelScale": { "minScale": null, "maxScale": null },
    "style": {
        "fillColor": "#fde68a",
        "fillOpacity": 0.3,
        "color": "#d97706",
        "opacity": 0.8,
        "weight": 2
    },
    "legend": { "label": "Secteurs d'éclairage" }
}
