{
    "id": "defaut",
    "label": "défaut",
    "description": "",
    "zoomConfig": {
        "minZoom": 20000000,
        "maxZoom": 0
    },
    "labelScale": {
        "minScale": null,
        "maxScale": null
    },
    "style": {
        "hatch": {
            "enabled": true,
            "type": "diagonal",
            "angleDeg": 45,
            "spacingPx": 10,
            "stroke": {
                "color": "#94d180",
                "opacity": 1,
                "widthPx": 1
            },
            "renderMode": "pattern_only"
        },
        "fillOpacity": 0,
        "color": "#8fb583",
        "opacity": 1,
        "weight": 1.51
    },
    "legend": {
        "label": "zones de conservation wdpa"
    }
}
