{
    "id": "defaut",
    "label": "Défaut",
    "description": "Volcans actifs historiques",
    "zoomConfig": {
        "minZoom": null,
        "maxZoom": null
    },
    "labelScale": {
        "minScale": null,
        "maxScale": null
    },
    "style": {
        "radius": 6,
        "fillColor": "#bb3e03",
        "fillOpacity": 0.85,
        "color": "#ffffff",
        "opacity": 1,
        "weight": 1
    },
    "legend": {
        "label": "Volcan actif"
    }
}
