{
    "id": "defaut",
    "label": "Défaut",
    "description": "Capitales et grandes villes",
    "zoomConfig": {
        "minZoom": null,
        "maxZoom": null
    },
    "labelScale": {
        "minScale": null,
        "maxScale": null
    },
    "style": {
        "radius": 4,
        "fillColor": "#e9c46a",
        "fillOpacity": 0.9,
        "color": "#264653",
        "opacity": 1,
        "weight": 1
    },
    "styleRules": [
        {
            "when": {
                "field": "properties.FEATURECLA",
                "operator": "==",
                "value": "Admin-0 capital"
            },
            "style": {
                "radius": 6,
                "fillColor": "#e76f51",
                "fillOpacity": 1,
                "color": "#264653",
                "weight": 1.5
            },
            "legend": {
                "label": "Capitale"
            }
        },
        {
            "when": {
                "field": "properties.FEATURECLA",
                "operator": "!=",
                "value": "Admin-0 capital"
            },
            "style": {
                "radius": 4,
                "fillColor": "#e9c46a",
                "fillOpacity": 0.85,
                "color": "#264653",
                "weight": 1
            },
            "legend": {
                "label": "Grande ville"
            }
        }
    ]
}
