{
    "id": "defaut",
    "label": "Par classe DPE",
    "legend": {
        "label": "Classe DPE"
    },
    "zoomConfig": { "minZoom": null, "maxZoom": null },
    "style": {
        "fillColor": "#dee2e6",
        "fillOpacity": 0.5,
        "color": "#6c757d",
        "weight": 1
    },
    "styleRules": [
        {
            "when": { "field": "classe_dpe", "operator": "==", "value": "A" },
            "style": {
                "fillColor": "#2a9d8f",
                "fillOpacity": 0.6,
                "color": "#264653",
                "weight": 1
            },
            "legend": { "label": "DPE A", "order": 1 }
        },
        {
            "when": { "field": "classe_dpe", "operator": "==", "value": "B" },
            "style": {
                "fillColor": "#57cc99",
                "fillOpacity": 0.55,
                "color": "#2a9d8f",
                "weight": 1
            },
            "legend": { "label": "DPE B", "order": 2 }
        },
        {
            "when": { "field": "classe_dpe", "operator": "==", "value": "C" },
            "style": {
                "fillColor": "#a8e6cf",
                "fillOpacity": 0.5,
                "color": "#57cc99",
                "weight": 1
            },
            "legend": { "label": "DPE C", "order": 3 }
        },
        {
            "when": { "field": "classe_dpe", "operator": "==", "value": "D" },
            "style": {
                "fillColor": "#e9c46a",
                "fillOpacity": 0.5,
                "color": "#f4a261",
                "weight": 1
            },
            "legend": { "label": "DPE D", "order": 4 }
        },
        {
            "when": { "field": "classe_dpe", "operator": "==", "value": "E" },
            "style": {
                "fillColor": "#f4a261",
                "fillOpacity": 0.55,
                "color": "#e76f51",
                "weight": 1
            },
            "legend": { "label": "DPE E", "order": 5 }
        },
        {
            "when": { "field": "classe_dpe", "operator": "==", "value": "F" },
            "style": {
                "fillColor": "#e76f51",
                "fillOpacity": 0.6,
                "color": "#d62828",
                "weight": 1
            },
            "legend": { "label": "DPE F", "order": 6 }
        },
        {
            "when": { "field": "classe_dpe", "operator": "==", "value": "G" },
            "style": {
                "fillColor": "#d62828",
                "fillOpacity": 0.65,
                "color": "#9b2226",
                "weight": 1
            },
            "legend": { "label": "DPE G", "order": 7 }
        }
    ]
}
